{
  "$schema": "https://json-schema.org/draft/2020-12/schema",
  "$id": "https://h2a-protocol.org/schemas/v0/h2a-core.decision-record.schema.json",
  "title": "H2A Core Decision Record",
  "description": "The signed record of a conformant-vs-non-conformant transmission decision. First-class schema object (ADR-006): H2A evidences, it does not enforce. This is the most commercially significant artefact for union / CMO procurement leverage — a non-conformant downstream transmission is recorded here explicitly.",
  "type": "object",
  "additionalProperties": false,
  "required": [
    "h2a_version",
    "record_id",
    "grant_id",
    "decision",
    "created_at",
    "alg",
    "signature"
  ],
  "properties": {
    "h2a_version": { "type": "string", "const": "0.1" },
    "record_id": { "type": "string", "pattern": "^[0-9a-fA-F-]{36}$" },
    "grant_id": { "type": "string", "pattern": "^[0-9a-fA-F-]{36}$" },
    "decision": {
      "type": "string",
      "enum": [
        "PERMITTED_CONFORMANT",
        "REFUSED_REVOKED",
        "REFUSED_OUT_OF_SCOPE",
        "REFUSED_LEASE_EXHAUSTED",
        "TRANSMITTED_NON_CONFORMANT"
      ]
    },
    "reason_code": { "type": "string" },
    "output_hash": { "type": "string", "pattern": "^sha256:[0-9a-f]{64}$" },
    "measured_latency_ms": {
      "type": "integer",
      "minimum": 0,
      "description": "Revocation-to-cutoff latency, measured at the issuer endpoint (not the operator), cross-checked against committed work."
    },
    "effective_chain_horizon": { "type": "string", "description": "Realised horizon of the chain = max of all links." },
    "max_chain_horizon": { "type": "string" },
    "horizon_committed_ms": {
      "type": "integer",
      "minimum": 0,
      "description": "Committed revocation horizon in force for this act, in milliseconds. What was promised. Core evidence field; when the commercial profile applies it is the horizon of the grant's assurance_level."
    },
    "horizon_measured_ms": {
      "type": "integer",
      "minimum": 0,
      "description": "Measured self-executor halt latency in milliseconds (ADR-006 as amended; ADR-013). What was delivered. Feeds the loss table. MAY be absent where a deployment does not yet instrument halt latency (see measured_latency_ms, which it supersedes for the SLA)."
    },
    "horizon_breach": {
      "type": "boolean",
      "description": "Derived: true when horizon_measured_ms > horizon_committed_ms. The SLA trigger. Absent when horizon_measured_ms is not populated."
    },
    "chain_conformance": {
      "type": "string",
      "enum": ["conformant", "non_conformant_downstream", "unknown"],
      "description": "Typed chain-conformance outcome for this act (formerly implicit in non_conformant_transmission)."
    },
    "exposure_snapshot": {
      "type": "object",
      "description": "Optional commercial-profile extension (SPEC-COMMERCIAL / h2a-commercial): per-act limit, aggregate limit, aggregate consumed, and assurance_level at the time of the act. Opaque to Core; constrained by the commercial profile. Not a Core conformance requirement (ADR-012); verifiers that do not implement the commercial profile MUST ignore it."
    },
    "non_conformant_transmission": {
      "type": ["object", "null"],
      "description": "Present and non-null ONLY when decision is TRANSMITTED_NON_CONFORMANT. Records a transmission that occurred outside conformance so it becomes admissible evidence.",
      "additionalProperties": false,
      "required": ["downstream_ref", "why"],
      "properties": {
        "downstream_ref": { "type": "string", "description": "Identifier of the downstream executor / channel that transmitted non-conformantly." },
        "why": { "type": "string", "enum": ["horizon_exceeded", "downstream_not_conformant", "check_bypassed"] },
        "horizon_exceeded_by_ms": { "type": "integer", "minimum": 0 }
      }
    },
    "witness": {
      "type": "object",
      "description": "External anchoring (ADR-005): RFC 3161 eIDAS-qualified TSA token + independent witness co-signature on the chain head. No blockchain.",
      "additionalProperties": false,
      "properties": {
        "tsa_token_ref": { "type": "string" },
        "witness_cosign_ref": { "type": "string" }
      }
    },
    "created_at": { "type": "string", "format": "date-time" },
    "alg": { "type": "string", "enum": ["ES256", "ES384", "EdDSA"], "default": "ES256" },
    "signature": { "type": "string" }
  },
  "allOf": [
    {
      "if": { "properties": { "decision": { "const": "TRANSMITTED_NON_CONFORMANT" } } },
      "then": { "required": ["non_conformant_transmission"], "properties": { "non_conformant_transmission": { "type": "object" } } }
    }
  ]
}
