{
  "h2a_version": "0.1",
  "record_id": "9d1f2b30-3333-4b2a-9c33-8a1b2c3d4e5f",
  "grant_id": "3f2a1c40-0d1e-4b2a-9c33-8a1b2c3d4e5f",
  "decision": "TRANSMITTED_NON_CONFORMANT",
  "reason_code": "downstream-exceeded-horizon",
  "measured_latency_ms": 5200,
  "effective_chain_horizon": "PT30M",
  "max_chain_horizon": "PT1H",
  "non_conformant_transmission": {
    "downstream_ref": "channel:partner-cdn-eu",
    "why": "horizon_exceeded",
    "horizon_exceeded_by_ms": 3400
  },
  "witness": { "tsa_token_ref": "tsa:rfc3161:xyz", "witness_cosign_ref": "witness:example:uvw" },
  "created_at": "2026-07-20T14:35:00Z",
  "alg": "ES256",
  "signature": "BASE64URL_SIG"
}
